{
  "$schema": "https://agent-plugins.org/schemas/1.0.0/plugin.schema.json",
  "name": "fr.lbke.formation-ia-agentique",
  "version": "1.0.13",
  "description": "Découvrir les concepts de l'IA agentique et construire un parcours d'apprentissage adapté à ses objectifs.",
  "author": {
    "name": "LBKE",
    "url": "https://www.lbke.fr"
  },
  "homepage": "https://www.lbke.fr/formations/",
  "repository": "https://github.com/lbke/agent-plugins-formation-ia-agentique",
  "license": "MIT",
  "keywords": ["formation", "IA agentique", "agents IA"],
  "extensions": {
    "com.openai": {
      "interface": {
        "displayName": "Formation IA agentique",
        "shortDescription": "Découvrez l'IA agentique.",
        "longDescription": "Un parcours guidé pour découvrir les concepts de l'IA agentique, clarifier ses objectifs et choisir une première étape adaptée.",
        "developerName": "LBKE",
        "category": "Education & Research",
        "websiteURL": "https://www.lbke.fr/formations/",
        "privacyPolicyURL": "https://www.lbke.fr/cgv",
        "termsOfServiceURL": "https://www.lbke.fr/cgv",
        "defaultPrompt": [
          "Aide-moi à commencer une formation sur l'IA agentique.",
          "Explique-moi ce qu'est un agent IA.",
          "Aide-moi à choisir un parcours adapté à mon niveau."
        ],
        "logo": "./assets/agentique_512.png",
        "brandColor": "#222d8f",
        "brandColorDark": "#ffffff"
      },
      "onboardingSkill": "./skills/demarrer-sa-formation-ia-agentique/SKILL.md",
      "publication": {
        "countries": ["FR", "BE", "CH"],
        "release_notes": "Parcours de découverte de l'IA agentique"
      },
      "review": {
        "test_cases": {
          "positive": [
            {
              "description": "L'utilisateur veut être évalué et mentionne la compétence identifier les cas d'usage.",
              "prompt": "Je connais les cas d'usage des agents IA. Évalue mon niveau de compétence en création d'agents IA selon les critères de LBKE.",
              "tools_triggered": "scorer-competences-creation-agent-ia",
              "expected_behavior": "Renvoie un ou plusieurs score évaluant le niveau de compétence en création d'agents IA."
            },
            {
              "description": "L'utilisateur veut être évalué et mentionne la compétence concevoir un agent IA.",
              "prompt": "Je sais concevoir une automatisation fondée sur un agent IA. Évalue mon niveau de compétence en création d'agents IA selon les critères de LBKE.",
              "tools_triggered": "scorer-competences-creation-agent-ia",
              "expected_behavior": "Renvoie un ou plusieurs score évaluant le niveau de compétence en création d'agents IA."
            },
            {
              "description": "L'utilisateur veut être évalué et mentionne la compétence créer un agent IA.",
              "prompt": "Je programme des agents en LangChain (Python). Évalue mon niveau de compétence en création d'agents IA selon les critères de LBKE.",
              "tools_triggered": "scorer-competences-creation-agent-ia",
              "expected_behavior": "Renvoie un ou plusieurs score évaluant le niveau de compétence en création d'agents IA."
            },
            {
              "description": "L'utilisateur veut être évalué et mentionne la capacité à évaluer des agents.",
              "prompt": "Je suis en charge de vérifier la sécurité des agents IA dans mon entreprise. Évalue mon niveau de compétence en création d'agents IA selon les critères de LBKE.",
              "tools_triggered": "scorer-competences-creation-agent-ia",
              "expected_behavior": "Renvoie un ou plusieurs score évaluant le niveau de compétence en création d'agents IA."
            },
            {
              "description": "L'utilisateur veut être évalué et mentionne la capacité à déployer un agent.",
              "prompt": "Je fais déjà fonctionner 8 agents en production. Évalue mon niveau de compétence en création d'agents IA selon les critères de LBKE.",
              "tools_triggered": "scorer-competences-creation-agent-ia",
              "expected_behavior": "Renvoie un ou plusieurs score évaluant le niveau de compétence en création d'agents IA."
            }
          ],
          "negative": [
            {
              "description": "Évaluation demandée mais compétences inconnues",
              "prompt": "Donne-moi mon score de compétence en création d'agents IA."
            },
            {
              "description": "Évaluation sur un autre sujet",
              "prompt": "Donne moi mon score de compétences en conception d'interfaces HTML"
            },
            {
              "description": "Pas de demande de score",
              "prompt": "Je suis très bon en création d'agents IA"
            }
          ]
        }
      }
    }
  }
}
