{
  "$schema": "https://agent-plugins.org/schemas/1.0.0/plugin.schema.json",
  "name": "fr.lbke.formation-langchain",
  "version": "1.0.12",
  "description": "Apprendre à concevoir des applications et des agents avec LangChain et LangGraph grâce à des explications progressives et des exercices guidés.",
  "author": {
    "name": "LBKE",
    "url": "https://www.lbke.fr"
  },
  "homepage": "https://www.lbke.fr/formations/",
  "repository": "https://github.com/lbke/agent-plugins-formation-ia-agentique",
  "license": "MIT",
  "keywords": [
    "formation",
    "LangChain",
    "LangGraph",
    "agents IA"
  ],
  "extensions": {
    "com.openai": {
      "interface": {
        "displayName": "Formation LangChain",
        "shortDescription": "Apprenez LangChain en Python.",
        "longDescription": "Une formation guidée pour apprendre à créer des applications et des agents avec LangChain et LangGraph, de l'environnement de développement au déploiement.",
        "developerName": "LBKE",
        "category": "Education & Research",
        "websiteURL": "https://www.lbke.fr/formations/",
        "privacyPolicyURL": "https://www.lbke.fr/cgv",
        "termsOfServiceURL": "https://www.lbke.fr/cgv",
        "defaultPrompt": [
          "Démarre ma formation LangChain et aide-moi à définir mon parcours.",
          "Aide-moi à démarrer un projet LangChain ou LangGraph.",
          "Aide-moi à créer un agent avec LangChain."
        ],
        "logo": "./assets/langchain_agentique_512.png",
        "brandColor": "#0d1013",
        "brandColorDark": "#b1deff"
      },
      "onboardingSkill": "./skills/demarrer-formation-langchain/SKILL.md",
      "publication": {
        "countries": [
          "FR",
          "BE",
          "CH"
        ],
        "release_notes": "Parcours centré sur LangChain et LangGraph"
      }
    }
  }
}
