{
  "$schema": "https://agent-plugins.org/schemas/1.0.0/plugin.schema.json",
  "name": "formation-ia-agentique",
  "version": "1.0.0",
  "description": "Apprendre à concevoir, utiliser et évaluer des systèmes d'IA agentique grâce à des explications et des exercices guidés.",
  "author": {
    "name": "LBKE",
    "url": "https://www.lbke.fr"
  },
  "homepage": "https://www.lbke.fr/formations/",
  "repository": "https://github.com/lbke/claude-plugin-formation-ia-agentique",
  "license": "MIT",
  "keywords": ["formation", "IA agentique", "LangChain", "LangGraph"]
}
